{
  "resultFormat": "pkic.cbom.policy-result",
  "resultFormatVersion": "0.1",
  "policy": {
    "policyId": "pkic.example.policy.readiness-gap",
    "version": "0.1",
    "file": "policy-readiness-gap.policy.json",
    "digest": {
      "alg": "SHA-256",
      "value": "649c21770410ff3a28766383916f582db3a8d86264db675a72978840a0e3f66c"
    }
  },
  "evaluationDate": "2026-10-25",
  "documents": [
    {
      "file": "cbom-keycloak-product.cdx.json",
      "serialNumber": "urn:uuid:6b3c1d2e-7a41-4c1e-9f0a-26730000c001",
      "version": 1,
      "subject": "pkg:oci/keycloak?repository_url=quay.io/keycloak/keycloak&tag=26.7.3",
      "subjectType": "product",
      "stage": "implemented",
      "digest": {
        "alg": "SHA-256",
        "value": "1b8fff9dad590241b73d19c37a23ab566c4e01113ec8e00d5adaca2c3f146897"
      }
    },
    {
      "file": "cbom-keycloak-deployment-configured.cdx.json",
      "serialNumber": "urn:uuid:8b1f0c2a-3d4e-4f50-8a61-7263740c0f01",
      "version": 1,
      "subject": "tag:example.org,2026:deployment/sso-prod",
      "subjectType": "deployment",
      "stage": "configured",
      "digest": {
        "alg": "SHA-256",
        "value": "75f545ccbbe382724aa5dcaa0b81a90f54d6045444ab7baf1fc6ef964839f76f"
      }
    },
    {
      "file": "cbom-keycloak-deployment-observed.cdx.json",
      "serialNumber": "urn:uuid:8b1f0c2a-3d4e-4f50-8a61-7263740b5e01",
      "version": 1,
      "subject": "tag:example.org,2026:deployment/sso-prod",
      "subjectType": "deployment",
      "stage": "observed",
      "digest": {
        "alg": "SHA-256",
        "value": "984208202f4b6b9100475416402b3252c77040248f4c9a47b0ef0c6ceaf07da6"
      }
    }
  ],
  "summary": {
    "enabled-not-negotiated": 1,
    "unknown": 1,
    "not-capable": 14,
    "unprotected": 4,
    "not-applicable": 4,
    "not-deployed": 4
  },
  "findings": [
    {
      "interface": {
        "implemented": null,
        "configured": "crypto:protocol:ing-tls",
        "observed": "crypto:protocol:ing-tls"
      },
      "purpose": "key-establishment",
      "evidence": {
        "implemented": null,
        "capability": null,
        "configured": [
          "X25519MLKEM768",
          "X25519"
        ],
        "observed": [
          "X25519MLKEM768",
          "X25519"
        ]
      },
      "class": "enabled-not-negotiated"
    },
    {
      "interface": {
        "implemented": null,
        "configured": "crypto:protocol:ing-tls",
        "observed": "crypto:protocol:ing-tls"
      },
      "purpose": "entity-authentication",
      "evidence": {
        "implemented": null,
        "capability": null,
        "configured": [
          "ECDSA-P256-SHA256"
        ],
        "observed": [
          "ECDSA-P256-SHA256"
        ]
      },
      "note": "no product record to say what the product can do",
      "class": "unknown"
    },
    {
      "interface": {
        "implemented": "crypto:protocol:int-db",
        "configured": "crypto:protocol:int-db",
        "observed": "crypto:protocol:int-db"
      },
      "purpose": "key-establishment",
      "evidence": {
        "implemented": [
          "peer-defined"
        ],
        "capability": [
          "x25519",
          "secp256r1",
          "secp384r1",
          "secp521r1",
          "x448",
          "ffdhe2048",
          "peer-defined"
        ],
        "configured": [
          "X25519",
          "secp256r1",
          "secp384r1",
          "secp521r1",
          "X448",
          "ffdhe2048"
        ],
        "observed": [
          "X25519"
        ]
      },
      "productCapability": {
        "capabilityStatus": "planned",
        "blockedBy": "provider",
        "roadmapRef": "https://openjdk.org/jeps/527"
      },
      "class": "not-capable"
    },
    {
      "interface": {
        "implemented": "crypto:protocol:int-db",
        "configured": "crypto:protocol:int-db",
        "observed": "crypto:protocol:int-db"
      },
      "purpose": "entity-authentication",
      "evidence": {
        "implemented": [
          "peer-defined"
        ],
        "capability": [
          "rsa_pss_rsae_sha256",
          "rsa_pkcs1_sha256",
          "rsa_pss_rsae_sha384",
          "rsa_pss_rsae_sha512",
          "ecdsa_secp256r1_sha256",
          "ecdsa_secp384r1_sha384",
          "ed25519",
          "peer-defined"
        ],
        "configured": [
          "RSA-2048"
        ],
        "observed": [
          "RSA-2048"
        ]
      },
      "productCapability": {
        "capabilityStatus": "under-evaluation",
        "blockedBy": "standard"
      },
      "class": "not-capable"
    },
    {
      "interface": {
        "implemented": "crypto:protocol:int-ldap",
        "configured": "crypto:protocol:int-ldap",
        "observed": "crypto:protocol:int-ldap"
      },
      "purpose": "key-establishment",
      "evidence": {
        "implemented": [
          "peer-defined"
        ],
        "capability": [
          "x25519",
          "secp256r1",
          "secp384r1",
          "secp521r1",
          "x448",
          "ffdhe2048",
          "peer-defined"
        ],
        "configured": [
          "X25519",
          "secp256r1",
          "secp384r1",
          "secp521r1",
          "X448",
          "ffdhe2048"
        ],
        "observed": [
          "secp384r1"
        ]
      },
      "productCapability": {
        "capabilityStatus": "planned",
        "blockedBy": "provider",
        "roadmapRef": "https://openjdk.org/jeps/527"
      },
      "class": "not-capable"
    },
    {
      "interface": {
        "implemented": "crypto:protocol:int-ldap",
        "configured": "crypto:protocol:int-ldap",
        "observed": "crypto:protocol:int-ldap"
      },
      "purpose": "entity-authentication",
      "evidence": {
        "implemented": [
          "peer-defined"
        ],
        "capability": [
          "rsa_pss_rsae_sha256",
          "rsa_pkcs1_sha256",
          "rsa_pss_rsae_sha384",
          "rsa_pss_rsae_sha512",
          "ecdsa_secp256r1_sha256",
          "ecdsa_secp384r1_sha384",
          "ed25519",
          "peer-defined"
        ],
        "configured": [
          "RSA-2048"
        ],
        "observed": [
          "RSA-2048"
        ]
      },
      "productCapability": {
        "capabilityStatus": "under-evaluation",
        "blockedBy": "standard"
      },
      "class": "not-capable"
    },
    {
      "interface": {
        "implemented": "crypto:protocol:int-cache",
        "configured": "crypto:protocol:int-cache",
        "observed": "crypto:protocol:int-cache"
      },
      "purpose": "key-establishment",
      "evidence": {
        "implemented": [
          "X25519"
        ],
        "capability": [
          "x25519",
          "secp256r1",
          "secp384r1",
          "secp521r1",
          "x448",
          "ffdhe2048",
          "X25519"
        ],
        "configured": [
          "X25519",
          "secp256r1",
          "secp384r1",
          "secp521r1",
          "X448",
          "ffdhe2048"
        ],
        "observed": [
          "X25519"
        ]
      },
      "productCapability": {
        "capabilityStatus": "planned",
        "blockedBy": "provider",
        "roadmapRef": "https://openjdk.org/jeps/527"
      },
      "class": "not-capable"
    },
    {
      "interface": {
        "implemented": "crypto:protocol:int-cache",
        "configured": "crypto:protocol:int-cache",
        "observed": "crypto:protocol:int-cache"
      },
      "purpose": "entity-authentication",
      "evidence": {
        "implemented": [
          "RSA-2048"
        ],
        "capability": [
          "rsa_pss_rsae_sha256",
          "rsa_pkcs1_sha256",
          "RSA-2048"
        ],
        "configured": [
          "RSA-2048"
        ],
        "observed": [
          "RSA-2048"
        ]
      },
      "productCapability": {
        "capabilityStatus": "under-evaluation",
        "blockedBy": "product"
      },
      "class": "not-capable"
    },
    {
      "interface": {
        "implemented": "service:svc-http",
        "configured": "service:svc-http",
        "observed": "service:svc-http"
      },
      "purpose": "key-establishment",
      "evidence": {
        "implemented": [
          "none"
        ],
        "capability": [
          "none",
          "none"
        ],
        "configured": [
          "none"
        ],
        "observed": [
          "none"
        ]
      },
      "class": "unprotected"
    },
    {
      "interface": {
        "implemented": "service:svc-http",
        "configured": "service:svc-http",
        "observed": "service:svc-http"
      },
      "purpose": "entity-authentication",
      "evidence": {
        "implemented": [
          "none"
        ],
        "capability": [
          "none",
          "none"
        ],
        "configured": [
          "none"
        ],
        "observed": [
          "none"
        ]
      },
      "class": "unprotected"
    },
    {
      "interface": {
        "implemented": "crypto:protocol:tls-mgmt",
        "configured": "service:mgmt-health",
        "observed": "service:mgmt-health"
      },
      "purpose": "key-establishment",
      "evidence": {
        "implemented": [
          "X25519"
        ],
        "capability": [
          "x25519",
          "secp256r1",
          "secp384r1",
          "secp521r1",
          "x448",
          "ffdhe2048",
          "X25519"
        ],
        "configured": [
          "none"
        ],
        "observed": [
          "none"
        ]
      },
      "class": "unprotected"
    },
    {
      "interface": {
        "implemented": "crypto:protocol:tls-mgmt",
        "configured": "service:mgmt-health",
        "observed": "service:mgmt-health"
      },
      "purpose": "entity-authentication",
      "evidence": {
        "implemented": [
          "deployment-defined"
        ],
        "capability": [
          "rsa_pss_rsae_sha256",